Link,Info
https://app.seamless-expo.com/event/seamless-saudi-arabia-2024/person/RXZlbnRQZW9wbGVfMzQ1MTA4MTA=,Ahmad Abu Qauod CEO Quality Business Solutions
https://app.seamless-expo.com/event/seamless-saudi-arabia-2024/person/RXZlbnRQZW9wbGVfMzM2NTUwMjc=,Houssam KHATIB CEO INFOTEC SYSTEMS
https://app.seamless-expo.com/event/seamless-saudi-arabia-2024/person/RXZlbnRQZW9wbGVfMzI2NzIzNDQ=,Mohamed Aboud CEO G I E FOR EVENTS MANAGEMENT L.L.C
https://app.seamless-expo.com/event/seamless-saudi-arabia-2024/person/RXZlbnRQZW9wbGVfMzQyMTI5Mjk=,Haris Puthiyathope CEO M2H Infotech LLP
https://app.seamless-expo.com/event/seamless-saudi-arabia-2024/person/RXZlbnRQZW9wbGVfMzQxNDUzMDY=,Nilesh Shah CEO Accely Group
https://app.seamless-expo.com/event/seamless-saudi-arabia-2024/person/RXZlbnRQZW9wbGVfMzMwMjEzNzU=,Ahmed Bugshan CEO HOI CIT
https://app.seamless-expo.com/event/seamless-saudi-arabia-2024/person/RXZlbnRQZW9wbGVfMzM2MjY4Njg=,Basim Zafar CEO Experts Vision Consulting
https://app.seamless-expo.com/event/seamless-saudi-arabia-2024/person/RXZlbnRQZW9wbGVfMzM2MTg4MzU=,SUJAS ALI CEO Aabasoft Technologies
https://app.seamless-expo.com/event/seamless-saudi-arabia-2024/person/RXZlbnRQZW9wbGVfMzM0ODI2ODg=,Chintan Shah CEO Brainvire Infotech Inc
https://app.seamless-expo.com/event/seamless-saudi-arabia-2024/person/RXZlbnRQZW9wbGVfMzI1MzM1MjY=,Ziad Allan CEO Rise Consulting
https://app.seamless-expo.com/event/seamless-saudi-arabia-2024/person/RXZlbnRQZW9wbGVfMzI1MzI5ODc=,Hajaj Alorainy CEO Integrated Solution Co.
https://app.seamless-expo.com/event/seamless-saudi-arabia-2024/person/RXZlbnRQZW9wbGVfMzQzNjU5MjY=,Paolo Checchi CEO Viche srl
https://app.seamless-expo.com/event/seamless-saudi-arabia-2024/person/RXZlbnRQZW9wbGVfMzM4OTE0MTE=,Ahmed Fahmy CEO OneCard
https://app.seamless-expo.com/event/seamless-saudi-arabia-2024/person/RXZlbnRQZW9wbGVfMzM1MjkzOTU=,DARIO JUNIOR CEO ESTRUTURAL BLOCK
https://app.seamless-expo.com/event/seamless-saudi-arabia-2024/person/RXZlbnRQZW9wbGVfMzI1MzMyOTU=,Dr Rajendrakumar Bidari CEO BRKINS
https://app.seamless-expo.com/event/seamless-saudi-arabia-2024/person/RXZlbnRQZW9wbGVfMzQzOTg2MzM=,"Husam Arabiat Regional CEO, Biz2Credit Saudi Credit Bureau - SIMAH"
https://app.seamless-expo.com/event/seamless-saudi-arabia-2024/person/RXZlbnRQZW9wbGVfMzQzOTg1MzI=,bassem sabra CEO Al rabie saudi foods
https://app.seamless-expo.com/event/seamless-saudi-arabia-2024/person/RXZlbnRQZW9wbGVfMzQzOTQ5MTI=,Bader Almatrfi CEO Billenda
https://app.seamless-expo.com/event/seamless-saudi-arabia-2024/person/RXZlbnRQZW9wbGVfMzQzOTIwNjM=,Marco Stranieri CEO HORIZON CORP FZCO
https://app.seamless-expo.com/event/seamless-saudi-arabia-2024/person/RXZlbnRQZW9wbGVfMzQzOTAzNDI=,Radhi AlRadhi CEO NeoMatrix Technologies
https://app.seamless-expo.com/event/seamless-saudi-arabia-2024/person/RXZlbnRQZW9wbGVfMzQzOTAxOTA=,Fahad Alghamdi CEO WOSUL
https://app.seamless-expo.com/event/seamless-saudi-arabia-2024/person/RXZlbnRQZW9wbGVfMzQzODg5Nzg=,Musfer Alyami CEO Marketing
https://app.seamless-expo.com/event/seamless-saudi-arabia-2024/person/RXZlbnRQZW9wbGVfMzQzODc5MDY=,Giorgi Sopromadze CEO Nexus
https://app.seamless-expo.com/event/seamless-saudi-arabia-2024/person/RXZlbnRQZW9wbGVfMzQzODc3NzQ=,Mohammed Alyahya CEO Excellent Solutions
https://app.seamless-expo.com/event/seamless-saudi-arabia-2024/person/RXZlbnRQZW9wbGVfMzQzODEwMzI=,Kamil Knap CEO Liang & Knap LLC
https://app.seamless-expo.com/event/seamless-saudi-arabia-2024/person/RXZlbnRQZW9wbGVfMzQzODAxMDQ=,Tarek Soliman CEO Three Eagles Holding Trading Co.
https://app.seamless-expo.com/event/seamless-saudi-arabia-2024/person/RXZlbnRQZW9wbGVfMzQzNzYzODE=,Mosaed Alenezy CEO Mudaraba Financial Co
https://app.seamless-expo.com/event/seamless-saudi-arabia-2024/person/RXZlbnRQZW9wbGVfMzQzNzYyMjk=,Usman Fiaz CEO Design peeps
https://app.seamless-expo.com/event/seamless-saudi-arabia-2024/person/RXZlbnRQZW9wbGVfMzQzNzI1NjA=,Muhammed Emir Bayram Deputy CEO linker
https://app.seamless-expo.com/event/seamless-saudi-arabia-2024/person/RXZlbnRQZW9wbGVfMzQzNjgzNjA=,Abdulelah Altowayan CEO Mazeej consultion
https://app.seamless-expo.com/event/seamless-saudi-arabia-2024/person/RXZlbnRQZW9wbGVfMzQzNjU5MzA=,Amro Abbas Executive Advisor to the CEO Vision Bank
https://app.seamless-expo.com/event/seamless-saudi-arabia-2024/person/RXZlbnRQZW9wbGVfMzQzNjU3OTA=,Hazem Abed CEO Abed Communications
https://app.seamless-expo.com/event/seamless-saudi-arabia-2024/person/RXZlbnRQZW9wbGVfMzQzNTkzMDk=,Ahmed Mohamed Abubaker CEO THANAWI
https://app.seamless-expo.com/event/seamless-saudi-arabia-2024/person/RXZlbnRQZW9wbGVfMzQzNTkwNDg=,Ibrahim Ali Alshaikh CEO Dunes Aero
https://app.seamless-expo.com/event/seamless-saudi-arabia-2024/person/RXZlbnRQZW9wbGVfMzQzNDA5Mzk=,Wasim Hamoud CEO MOOLA
https://app.seamless-expo.com/event/seamless-saudi-arabia-2024/person/RXZlbnRQZW9wbGVfMzQzMzYzNjU=,عوض القحطاني CEO Bsure_sa
https://app.seamless-expo.com/event/seamless-saudi-arabia-2024/person/RXZlbnRQZW9wbGVfMzQzMzUyMTU=,Abdulla AlYousuf CEO Wseel Digital Broker
https://app.seamless-expo.com/event/seamless-saudi-arabia-2024/person/RXZlbnRQZW9wbGVfMzQzMzUyMTM=,Zain Ali CEO Fortify
https://app.seamless-expo.com/event/seamless-saudi-arabia-2024/person/RXZlbnRQZW9wbGVfMzQzMzUyMTI=,Ahmed Kadous CEO Pharmacy marts
https://app.seamless-expo.com/event/seamless-saudi-arabia-2024/person/RXZlbnRQZW9wbGVfMzQzMzU1ODQ=,Omar Alluhayyan CEO Blend
https://app.seamless-expo.com/event/seamless-saudi-arabia-2024/person/RXZlbnRQZW9wbGVfMzQzMzMxMTE=,Shahzad Shahid CEO TPS worldwide
https://app.seamless-expo.com/event/seamless-saudi-arabia-2024/person/RXZlbnRQZW9wbGVfMzQzMjk1MTg=,Muhammed Eljack CEO Scalable Hacks Consulting
https://app.seamless-expo.com/event/seamless-saudi-arabia-2024/person/RXZlbnRQZW9wbGVfMzQzMjY2MDk=,MOHAMED ALAfif Managing Director and CEO Cash Solutions Company Limited
https://app.seamless-expo.com/event/seamless-saudi-arabia-2024/person/RXZlbnRQZW9wbGVfMzQzMjQ3NDY=,Amine Fassi Fihri CEO INDATACORE
https://app.seamless-expo.com/event/seamless-saudi-arabia-2024/person/RXZlbnRQZW9wbGVfMzQzMjM3NjU=,Mohamed Eldib ceo LWG Egypt .S.A.E.
https://app.seamless-expo.com/event/seamless-saudi-arabia-2024/person/RXZlbnRQZW9wbGVfMzQzMjIxMTE=,Hussein Attar CEO Tech Invest Com
https://app.seamless-expo.com/event/seamless-saudi-arabia-2024/person/RXZlbnRQZW9wbGVfMzQzMjE1NTI=,Sergey Budnikov CEO Jefferson & Bennett Holding Ltd (Moneyport)
https://app.seamless-expo.com/event/seamless-saudi-arabia-2024/person/RXZlbnRQZW9wbGVfMzQzMjE0MDg=,Rajab Ali Virani CEO VeriEstate Tech Limited
https://app.seamless-expo.com/event/seamless-saudi-arabia-2024/person/RXZlbnRQZW9wbGVfMzQzMjA3NjI=,Tariq Alturkestani CEO saee
https://app.seamless-expo.com/event/seamless-saudi-arabia-2024/person/RXZlbnRQZW9wbGVfMzQzMjA2NDM=,Abdullah Aldahash CEO Seulah Finance company
https://app.seamless-expo.com/event/seamless-saudi-arabia-2024/person/RXZlbnRQZW9wbGVfMzQyOTkxNDU=,Bassam Shhadat CEO 2P PR & Digital Marketing
https://app.seamless-expo.com/event/seamless-saudi-arabia-2024/person/RXZlbnRQZW9wbGVfMzQyOTkxNDM=,MOHAMMED ABBAS CEO CarZone
https://app.seamless-expo.com/event/seamless-saudi-arabia-2024/person/RXZlbnRQZW9wbGVfMzQyOTM0NzY=,Muhammad Nafey CEO eTaps.me
https://app.seamless-expo.com/event/seamless-saudi-arabia-2024/person/RXZlbnRQZW9wbGVfMzQyODY2OTQ=,Jason Robinson CEO Finserve.io
https://app.seamless-expo.com/event/seamless-saudi-arabia-2024/person/RXZlbnRQZW9wbGVfMzQyNzkwNzY=,Ghormallah Alghamdi CEO EdfaPay
https://app.seamless-expo.com/event/seamless-saudi-arabia-2024/person/RXZlbnRQZW9wbGVfMzQyNzgyNTE=,Ahmed Alghamdi CEO Human Resources Channels by Stc
https://app.seamless-expo.com/event/seamless-saudi-arabia-2024/person/RXZlbnRQZW9wbGVfMzQyNzcwOTM=,Mohannad Alsouqi CEO Talentspace.ai
https://app.seamless-expo.com/event/seamless-saudi-arabia-2024/person/RXZlbnRQZW9wbGVfMzQyNzYzNDM=,Joe Rabah CEO Connectiv
https://app.seamless-expo.com/event/seamless-saudi-arabia-2024/person/RXZlbnRQZW9wbGVfMzQyNzY3NDk=,Ali AlMeshal CEO PaymentsCo
https://app.seamless-expo.com/event/seamless-saudi-arabia-2024/person/RXZlbnRQZW9wbGVfMzQyNzY2MTQ=,Tarek Shaker CEO Smart Health medical Co.
https://app.seamless-expo.com/event/seamless-saudi-arabia-2024/person/RXZlbnRQZW9wbGVfMzQyNzMxNDU=,Faraz Quddusi CEO QBS Co
https://app.seamless-expo.com/event/seamless-saudi-arabia-2024/person/RXZlbnRQZW9wbGVfMzQyNjkyNTQ=,Omar Youssef CEO InnovatorsGate
https://app.seamless-expo.com/event/seamless-saudi-arabia-2024/person/RXZlbnRQZW9wbGVfMzQyNjc4ODI=,Mohammed Al Kuraimi CEO Tayseer Innovations LLC
https://app.seamless-expo.com/event/seamless-saudi-arabia-2024/person/RXZlbnRQZW9wbGVfMzQyNjMzMTA=,Jaffer Hussain Syed CEO SecureMax
https://app.seamless-expo.com/event/seamless-saudi-arabia-2024/person/RXZlbnRQZW9wbGVfMzQyNjM1MDA=,Veronica Studsgaard CEO IAMTN
https://app.seamless-expo.com/event/seamless-saudi-arabia-2024/person/RXZlbnRQZW9wbGVfMzQyNDUzNjA=,Bahaaddin Salim CEO NASS AL IRAQ HOLDING
https://app.seamless-expo.com/event/seamless-saudi-arabia-2024/person/RXZlbnRQZW9wbGVfMzQyNDUzNTk=,Muhammad Umar CEO WebSols Pakistan
https://app.seamless-expo.com/event/seamless-saudi-arabia-2024/person/RXZlbnRQZW9wbGVfMzQyNDUwNDM=,Fouad Nasseredin CEO Admireworks Advertising LLC
https://app.seamless-expo.com/event/seamless-saudi-arabia-2024/person/RXZlbnRQZW9wbGVfMzQyNDQ5NzI=,Hyder Cohen CEO tcig
https://app.seamless-expo.com/event/seamless-saudi-arabia-2024/person/RXZlbnRQZW9wbGVfMzQyMTMzNDI=,Laith Nobani CEO & Managing Partner BLUNET Marketing & Communication Services
https://app.seamless-expo.com/event/seamless-saudi-arabia-2024/person/RXZlbnRQZW9wbGVfMzQyMTMyNDE=,mejdi Housseini CEO Twin c
https://app.seamless-expo.com/event/seamless-saudi-arabia-2024/person/RXZlbnRQZW9wbGVfMzQyMTI5Nzk=,Khaled Hafez CEO IBG TECHNOLOGY
https://app.seamless-expo.com/event/seamless-saudi-arabia-2024/person/RXZlbnRQZW9wbGVfMzQyMTE4OTg=,Ali AlShehri CEO Code95
https://app.seamless-expo.com/event/seamless-saudi-arabia-2024/person/RXZlbnRQZW9wbGVfMzQyMTE3Nzg=,Ayman AlHaffar CEO DATALAB
https://app.seamless-expo.com/event/seamless-saudi-arabia-2024/person/RXZlbnRQZW9wbGVfMzQxODc0NjA=,Angus Chiu CEO MineSec SoftPOS
https://app.seamless-expo.com/event/seamless-saudi-arabia-2024/person/RXZlbnRQZW9wbGVfMzQxODYyMTU=,Diaa Yousef CEO Agri Soft
https://app.seamless-expo.com/event/seamless-saudi-arabia-2024/person/RXZlbnRQZW9wbGVfMzQxODY3MTc=,Mohammad Al Zayyat CEO Holland Acumen
https://app.seamless-expo.com/event/seamless-saudi-arabia-2024/person/RXZlbnRQZW9wbGVfMzQxODU1Nzc=,Ashish Kumar Singh CEO Loyyal
https://app.seamless-expo.com/event/seamless-saudi-arabia-2024/person/RXZlbnRQZW9wbGVfMzQxNTE0OTE=,Michael Hunter Ceo Holo
https://app.seamless-expo.com/event/seamless-saudi-arabia-2024/person/RXZlbnRQZW9wbGVfMzQxMjg0ODY=,Firas Shabaneh CEO Bigfish Marketing Solutions
https://app.seamless-expo.com/event/seamless-saudi-arabia-2024/person/RXZlbnRQZW9wbGVfMzQxMjA4MjQ=,Aravinda Korala CEO KAL
https://app.seamless-expo.com/event/seamless-saudi-arabia-2024/person/RXZlbnRQZW9wbGVfMzQxMTU5MjM=,Mohamed Awadallah CEO Glamera
https://app.seamless-expo.com/event/seamless-saudi-arabia-2024/person/RXZlbnRQZW9wbGVfMzQxMTQyMzg=,Qusai Alsaif CEO & Managing Partner Sadu Capital
https://app.seamless-expo.com/event/seamless-saudi-arabia-2024/person/RXZlbnRQZW9wbGVfMzQxMTMyMjY=,Farooq Cheema CEO Tablon B2B
https://app.seamless-expo.com/event/seamless-saudi-arabia-2024/person/RXZlbnRQZW9wbGVfMzQxMTI5MDY=,Atif Nimir CEO WE-14 for information technology
https://app.seamless-expo.com/event/seamless-saudi-arabia-2024/person/RXZlbnRQZW9wbGVfMzQxMTEyMDQ=,Archie Rudyuk CEO of Takefluence Admitad
https://app.seamless-expo.com/event/seamless-saudi-arabia-2024/person/RXZlbnRQZW9wbGVfMzQxMTA4OTU=,Anna Gidirim CEO of Admitad Admitad
https://app.seamless-expo.com/event/seamless-saudi-arabia-2024/person/RXZlbnRQZW9wbGVfMzQwOTE2OTg=,Hytham ElSaiid CEO CROWZE
https://app.seamless-expo.com/event/seamless-saudi-arabia-2024/person/RXZlbnRQZW9wbGVfMzQwNjc1NjU=,Saravana Cavala Damodaram CEO Bytize Technology Solutions LLC
https://app.seamless-expo.com/event/seamless-saudi-arabia-2024/person/RXZlbnRQZW9wbGVfMzQwMjg3OTI=,Atheshamuddin Mohammed CEO OriginFuture Tech Pvt Ltd
https://app.seamless-expo.com/event/seamless-saudi-arabia-2024/person/RXZlbnRQZW9wbGVfMzQwMjYxMjE=,Nono Ghannam CEO Stllr Network Inc.
https://app.seamless-expo.com/event/seamless-saudi-arabia-2024/person/RXZlbnRQZW9wbGVfMzQwMDQ4MDY=,Mohammad Alyousef CEO Alamah
https://app.seamless-expo.com/event/seamless-saudi-arabia-2024/person/RXZlbnRQZW9wbGVfMzQwMDMxODQ=,Saady Lozon CEO Unit One Group
https://app.seamless-expo.com/event/seamless-saudi-arabia-2024/person/RXZlbnRQZW9wbGVfMzQwMDM5NDE=,Karim Hassoun CEO RAK GROUP SARL
https://app.seamless-expo.com/event/seamless-saudi-arabia-2024/person/RXZlbnRQZW9wbGVfMzQwMDIwMTg=,Andreas Khoshnou CEO Be1B
https://app.seamless-expo.com/event/seamless-saudi-arabia-2024/person/RXZlbnRQZW9wbGVfMzQwMDEwMDQ=,Mohammed Khumayes CEO Digital Solutions Holding
https://app.seamless-expo.com/event/seamless-saudi-arabia-2024/person/RXZlbnRQZW9wbGVfMzQwMDA4NzA=,Ahmed Yassin CEO Avrio
https://app.seamless-expo.com/event/seamless-saudi-arabia-2024/person/RXZlbnRQZW9wbGVfMzQ1MjE3MzA=,Ozer Balkiz Ceo Brq Link Payment Services Inc.
https://app.seamless-expo.com/event/seamless-saudi-arabia-2024/person/RXZlbnRQZW9wbGVfMzQ1MTkyNTI=,Mohamed Elbeheiry CEO EyeGo
https://app.seamless-expo.com/event/seamless-saudi-arabia-2024/person/RXZlbnRQZW9wbGVfMzQ1MTg3MDc=,Mohammed Albager CEO Durra Marketing Agency
https://app.seamless-expo.com/event/seamless-saudi-arabia-2024/person/RXZlbnRQZW9wbGVfMzQ1MTg2OTU=,Riyaz Khan CEO masraf
https://app.seamless-expo.com/event/seamless-saudi-arabia-2024/person/RXZlbnRQZW9wbGVfMzQ1MTg0MDk=,Ehsan Nehlawi CEO EASYTAKE App.
https://app.seamless-expo.com/event/seamless-saudi-arabia-2024/person/RXZlbnRQZW9wbGVfMzQ1MTMwMzQ=,Musaad AlGadi CEO Saudi Financial Technology - Alinma Bank
https://app.seamless-expo.com/event/seamless-saudi-arabia-2024/person/RXZlbnRQZW9wbGVfMzQ1MTM5MjU=,Emad Hegazy CEO Geer Contracting Co.
https://app.seamless-expo.com/event/seamless-saudi-arabia-2024/person/RXZlbnRQZW9wbGVfMzQ1MTI4MzA=,Amjad Shacker CEO Eventus
https://app.seamless-expo.com/event/seamless-saudi-arabia-2024/person/RXZlbnRQZW9wbGVfMzQ1MTE5OTU=,MOHAMMED Khalil CEO DAL SEEN
https://app.seamless-expo.com/event/seamless-saudi-arabia-2024/person/RXZlbnRQZW9wbGVfMzQ1MDk2NTg=,Faeez Mushtaq CEO Collatree Arabia
https://app.seamless-expo.com/event/seamless-saudi-arabia-2024/person/RXZlbnRQZW9wbGVfMzQ1MDgyMzk=,Ibrahim El hashmi CEO Smart solution
https://app.seamless-expo.com/event/seamless-saudi-arabia-2024/person/RXZlbnRQZW9wbGVfMzQ1MDY3Mjg=,Ashish Saraf CEO OneSattva LLC
https://app.seamless-expo.com/event/seamless-saudi-arabia-2024/person/RXZlbnRQZW9wbGVfMzQ1MDY2ODU=,Abdulrhman Basha CEO IBrand
https://app.seamless-expo.com/event/seamless-saudi-arabia-2024/person/RXZlbnRQZW9wbGVfMzQ1MDU3MDI=,Luke Bodnar Ceo Yambod Group
https://app.seamless-expo.com/event/seamless-saudi-arabia-2024/person/RXZlbnRQZW9wbGVfMzQ1MDMxMjc=,AHMED AL FAKHRI CEO Kafaratplus
https://app.seamless-expo.com/event/seamless-saudi-arabia-2024/person/RXZlbnRQZW9wbGVfMzQ1MDEwODc=,Abo Assaf Alassaf CEO Alassaf
https://app.seamless-expo.com/event/seamless-saudi-arabia-2024/person/RXZlbnRQZW9wbGVfMzQ0OTYyODg=,Ali Malik CEO ASM
https://app.seamless-expo.com/event/seamless-saudi-arabia-2024/person/RXZlbnRQZW9wbGVfMzQ0OTQ1NDQ=,Ibrahim Alzuhaimeel ceo OceanX
https://app.seamless-expo.com/event/seamless-saudi-arabia-2024/person/RXZlbnRQZW9wbGVfMzQ0OTMwOTc=,Omar Al Awlaqi CEO Satel
https://app.seamless-expo.com/event/seamless-saudi-arabia-2024/person/RXZlbnRQZW9wbGVfMzQ0OTM4NTE=,mohareb alrshidi CEO Igate
https://app.seamless-expo.com/event/seamless-saudi-arabia-2024/person/RXZlbnRQZW9wbGVfMzQ0OTM4NDI=,Abdulaziz Alobaid CEO SHARE INVESTMENT
https://app.seamless-expo.com/event/seamless-saudi-arabia-2024/person/RXZlbnRQZW9wbGVfMzQ0OTM3MjI=,Bassam Alaujan CEO ProsperUs
https://app.seamless-expo.com/event/seamless-saudi-arabia-2024/person/RXZlbnRQZW9wbGVfMzQ0OTI4MTg=,Khalid Al Adad CEO Ollkom Group
https://app.seamless-expo.com/event/seamless-saudi-arabia-2024/person/RXZlbnRQZW9wbGVfMzQ0OTI3MTY=,فراس اليحيى CEO Balsmy
https://app.seamless-expo.com/event/seamless-saudi-arabia-2024/person/RXZlbnRQZW9wbGVfMzQ0OTEyMjE=,Majed Alfar CEO NOQOOD
https://app.seamless-expo.com/event/seamless-saudi-arabia-2024/person/RXZlbnRQZW9wbGVfMzQ0OTA0MjA=,Samer Alwaeli CEO SAMA
https://app.seamless-expo.com/event/seamless-saudi-arabia-2024/person/RXZlbnRQZW9wbGVfMzQ0ODgxMDU=,Ashish Parakh CEO AJM Softwares
https://app.seamless-expo.com/event/seamless-saudi-arabia-2024/person/RXZlbnRQZW9wbGVfMzQ0ODg3MDU=,Belal Farahat CEO Noqta Plus Marketing Network
https://app.seamless-expo.com/event/seamless-saudi-arabia-2024/person/RXZlbnRQZW9wbGVfMzQ0ODY3MjM=,Assem El Bassal CEO Mubasher.info KSA- Global Financial Media Dubai
https://app.seamless-expo.com/event/seamless-saudi-arabia-2024/person/RXZlbnRQZW9wbGVfMzQ0ODQwMDQ=,anas alsakka ceo Business Summit
https://app.seamless-expo.com/event/seamless-saudi-arabia-2024/person/RXZlbnRQZW9wbGVfMzQ0ODQ2MjI=,Aimen Saleh Ahmad CEO AlMatar Group
https://app.seamless-expo.com/event/seamless-saudi-arabia-2024/person/RXZlbnRQZW9wbGVfMzQ0ODMzNjg=,Mahmoud Hassaan Ceo Angazny.com
https://app.seamless-expo.com/event/seamless-saudi-arabia-2024/person/RXZlbnRQZW9wbGVfMzQ0ODMyMjk=,Rakan Saad Aljumah CEO Interkey Company for Communication & Computer
https://app.seamless-expo.com/event/seamless-saudi-arabia-2024/person/RXZlbnRQZW9wbGVfMzQ0ODM3MjY=,Mohammed Al Ghuben Ceo Yarno
https://app.seamless-expo.com/event/seamless-saudi-arabia-2024/person/RXZlbnRQZW9wbGVfMzQ0ODA1MDk=,Mutaib Alruhaimi CEO Expert Creators
https://app.seamless-expo.com/event/seamless-saudi-arabia-2024/person/RXZlbnRQZW9wbGVfMzQ0NzkxODI=,Qusay Salama CEO PlusOne Health
https://app.seamless-expo.com/event/seamless-saudi-arabia-2024/person/RXZlbnRQZW9wbGVfMzQ0NzgxMjY=,Shariq AbdulHai CEO VALIANT & COMPANY
https://app.seamless-expo.com/event/seamless-saudi-arabia-2024/person/RXZlbnRQZW9wbGVfMzQ0NzUxNDY=,Mohammed Alshehri CEO catron
https://app.seamless-expo.com/event/seamless-saudi-arabia-2024/person/RXZlbnRQZW9wbGVfMzQ0NzU5Nzc=,omran badarneh CEO THEDEEPBRAIN
https://app.seamless-expo.com/event/seamless-saudi-arabia-2024/person/RXZlbnRQZW9wbGVfMzQ0NzQ1MDc=,Abdullah Harmal CEO Felix Land int
https://app.seamless-expo.com/event/seamless-saudi-arabia-2024/person/RXZlbnRQZW9wbGVfMzQ0NzIxMTg=,Hussein Alharbi CEO KluesAI
https://app.seamless-expo.com/event/seamless-saudi-arabia-2024/person/RXZlbnRQZW9wbGVfMzQ0NzE1MDA=,Omnia Fouad CEO OmniaStores LLC
https://app.seamless-expo.com/event/seamless-saudi-arabia-2024/person/RXZlbnRQZW9wbGVfMzQ0NjQyODk=,Fadi Yahya CEO Suplift
https://app.seamless-expo.com/event/seamless-saudi-arabia-2024/person/RXZlbnRQZW9wbGVfMzQ0NDUzMjI=,Jiten Padmashali CEO Krish Technolabs
https://app.seamless-expo.com/event/seamless-saudi-arabia-2024/person/RXZlbnRQZW9wbGVfMzQ0MzczNzg=,Husain Makiya CEO YouGotaGift.com
https://app.seamless-expo.com/event/seamless-saudi-arabia-2024/person/RXZlbnRQZW9wbGVfMzQ0MzYwMzA=,Manuel Pacreau CEO Addict Mobile
https://app.seamless-expo.com/event/seamless-saudi-arabia-2024/person/RXZlbnRQZW9wbGVfMzQ0MzQ2MzY=,Majed Al Rasheed CEO FinArabia
https://app.seamless-expo.com/event/seamless-saudi-arabia-2024/person/RXZlbnRQZW9wbGVfMzQ0MjQyNDQ=,Mohamed Baddar CEO Alsun AI
https://app.seamless-expo.com/event/seamless-saudi-arabia-2024/person/RXZlbnRQZW9wbGVfMzQ0MjExOTk=,Bandar Alghamdi CEO Alpha Digital
https://app.seamless-expo.com/event/seamless-saudi-arabia-2024/person/RXZlbnRQZW9wbGVfMzQ0MTE4Mjk=,Lalit Mendapara CEO ASPIRE SOFTWARE CONSULTANCY
https://app.seamless-expo.com/event/seamless-saudi-arabia-2024/person/RXZlbnRQZW9wbGVfMzQ0MDgyNDg=,Ivan Grechkivsky CEO Family Garden LLC
https://app.seamless-expo.com/event/seamless-saudi-arabia-2024/person/RXZlbnRQZW9wbGVfMzQ0MDc4NzE=,Hatem Kameli CEO Resal
https://app.seamless-expo.com/event/seamless-saudi-arabia-2024/person/RXZlbnRQZW9wbGVfMzQ0MDU5MTE=,Maymoonah Mohammed CEO LVLUP
https://app.seamless-expo.com/event/seamless-saudi-arabia-2024/person/RXZlbnRQZW9wbGVfMzMzOTY5Nzg=,Nuslia Nushra Akhter CEO AND MANAGING DIRECTOR Al Nuqtat LLC
https://app.seamless-expo.com/event/seamless-saudi-arabia-2024/person/RXZlbnRQZW9wbGVfMzMzNzQ5MjY=,Abdulaziz Almogrin CEO JIFF technology
https://app.seamless-expo.com/event/seamless-saudi-arabia-2024/person/RXZlbnRQZW9wbGVfMzMzMzQxMDE=,Aldiyar Seidali CEO Zaytoon Antler
https://app.seamless-expo.com/event/seamless-saudi-arabia-2024/person/RXZlbnRQZW9wbGVfMzMzMjQ0MjY=,Samad Saleem CEO DigiTrends
https://app.seamless-expo.com/event/seamless-saudi-arabia-2024/person/RXZlbnRQZW9wbGVfMzMzMTE5MTQ=,Abror Kholov CEO Wyzo
https://app.seamless-expo.com/event/seamless-saudi-arabia-2024/person/RXZlbnRQZW9wbGVfMzMyMDA5NTg=,Jakub Jodłowski CEO Qarbon IT
https://app.seamless-expo.com/event/seamless-saudi-arabia-2024/person/RXZlbnRQZW9wbGVfMzMxODc0Mzc=,Mansour Alshuaibi CEO Qsalary
https://app.seamless-expo.com/event/seamless-saudi-arabia-2024/person/RXZlbnRQZW9wbGVfMzMxODA2NTQ=,Simon Littlewood CEO Sdg Global Group
https://app.seamless-expo.com/event/seamless-saudi-arabia-2024/person/RXZlbnRQZW9wbGVfMzMxODA1NDA=,Moataz Othman CEO Imknat.com.sa
https://app.seamless-expo.com/event/seamless-saudi-arabia-2024/person/RXZlbnRQZW9wbGVfMzMxNzQ5NzE=,Husam Habannakeh CEO Baksheesh
https://app.seamless-expo.com/event/seamless-saudi-arabia-2024/person/RXZlbnRQZW9wbGVfMzMxNDYxNjA=,Asif Iqbal CEO Prime Manpower & Testing Service (SMC-Private) Limited
https://app.seamless-expo.com/event/seamless-saudi-arabia-2024/person/RXZlbnRQZW9wbGVfMzMwODAyMzk=,Abdul Wadood CEO Digitify Ltd
https://app.seamless-expo.com/event/seamless-saudi-arabia-2024/person/RXZlbnRQZW9wbGVfMzMwNzc2Mjg=,Mohamed Ahmed CEO Gulf Advanced Technology
https://app.seamless-expo.com/event/seamless-saudi-arabia-2024/person/RXZlbnRQZW9wbGVfMzMwNTg2NjI=,Janti Abdallah CEO PayOne
https://app.seamless-expo.com/event/seamless-saudi-arabia-2024/person/RXZlbnRQZW9wbGVfMzMwNDM3MTY=,Amine Zrikem CEO Mediaster Marketing Agency
https://app.seamless-expo.com/event/seamless-saudi-arabia-2024/person/RXZlbnRQZW9wbGVfMzMwMzM0Njg=,Ehsan Nehlawi CEO Easytake
https://app.seamless-expo.com/event/seamless-saudi-arabia-2024/person/RXZlbnRQZW9wbGVfMzMwMzA0MjI=,Michael Edge CEO Big Future Club
https://app.seamless-expo.com/event/seamless-saudi-arabia-2024/person/RXZlbnRQZW9wbGVfMzM5OTM1MzE=,AKM Ahmedul Islam Managing Director & CEO TechKnowGram Limited
https://app.seamless-expo.com/event/seamless-saudi-arabia-2024/person/RXZlbnRQZW9wbGVfMzM5ODg4Njg=,Kanaan Amr CEO Enablergcc
https://app.seamless-expo.com/event/seamless-saudi-arabia-2024/person/RXZlbnRQZW9wbGVfMzM5Nzk0MDk=,Hassan Alamoudi CEO Grocsale
https://app.seamless-expo.com/event/seamless-saudi-arabia-2024/person/RXZlbnRQZW9wbGVfMzM5NzM2OTE=,Jari Almuntshiri CEO Dlight
https://app.seamless-expo.com/event/seamless-saudi-arabia-2024/person/RXZlbnRQZW9wbGVfMzM5NzM1MTU=,Saad Radany CEO Tecsee GmbH
https://app.seamless-expo.com/event/seamless-saudi-arabia-2024/person/RXZlbnRQZW9wbGVfMzM5NzM1MTQ=,Sherif Shaalan CEO Pianat.ai
https://app.seamless-expo.com/event/seamless-saudi-arabia-2024/person/RXZlbnRQZW9wbGVfMzM5NjUzODg=,Muhammad Tayab CTO/CEO EmergTech Solutions
https://app.seamless-expo.com/event/seamless-saudi-arabia-2024/person/RXZlbnRQZW9wbGVfMzM5NjQ2OTc=,Mahmoud Qolqala CEO Mentoring platfrom
https://app.seamless-expo.com/event/seamless-saudi-arabia-2024/person/RXZlbnRQZW9wbGVfMzM5NTczODE=,Hasan Sami Bayansar CEO İnsha Ventures
https://app.seamless-expo.com/event/seamless-saudi-arabia-2024/person/RXZlbnRQZW9wbGVfMzM5NTM4NzA=,Tino Waked CEO - Middle East Taptap Send
https://app.seamless-expo.com/event/seamless-saudi-arabia-2024/person/RXZlbnRQZW9wbGVfMzM5NDgwMTI=,Elias Elkhoury Ceo Promoteam
https://app.seamless-expo.com/event/seamless-saudi-arabia-2024/person/RXZlbnRQZW9wbGVfMzM5NDc3ODQ=,Khalid Khamis CEO Data Box Hub
https://app.seamless-expo.com/event/seamless-saudi-arabia-2024/person/RXZlbnRQZW9wbGVfMzM5NDc2NDA=,Sherif Nabil CEO Masar
https://app.seamless-expo.com/event/seamless-saudi-arabia-2024/person/RXZlbnRQZW9wbGVfMzM5Mzc3OTQ=,Trevor Cohen Group CEO IQSM Limited
https://app.seamless-expo.com/event/seamless-saudi-arabia-2024/person/RXZlbnRQZW9wbGVfMzM5MDEyOTY=,Mohamed Ibrahim CEO Lahint
https://app.seamless-expo.com/event/seamless-saudi-arabia-2024/person/RXZlbnRQZW9wbGVfMzM4OTA3NTc=,Ashraf Alharbi CEO Appsec
https://app.seamless-expo.com/event/seamless-saudi-arabia-2024/person/RXZlbnRQZW9wbGVfMzM4OTA1ODY=,Abdulraheem Almoslat CEO Ramz Aloula
https://app.seamless-expo.com/event/seamless-saudi-arabia-2024/person/RXZlbnRQZW9wbGVfMzM4ODAxMTU=,Umar Saleem CEO Maven Investment Partners
https://app.seamless-expo.com/event/seamless-saudi-arabia-2024/person/RXZlbnRQZW9wbGVfMzM4NjkyNTQ=,Jimmy Zhang CEO YONI INTERNATIONAL PTE. LTD.
https://app.seamless-expo.com/event/seamless-saudi-arabia-2024/person/RXZlbnRQZW9wbGVfMzM4NjY3OTI=,Laith Nobani CEO BLUNET Marketing & Communication Services
https://app.seamless-expo.com/event/seamless-saudi-arabia-2024/person/RXZlbnRQZW9wbGVfMzM3OTgyMjQ=,Amr Salem CEO private
https://app.seamless-expo.com/event/seamless-saudi-arabia-2024/person/RXZlbnRQZW9wbGVfMzM3OTc3MjU=,Khalid Al-Zahrani CEO Qayd
https://app.seamless-expo.com/event/seamless-saudi-arabia-2024/person/RXZlbnRQZW9wbGVfMzM3ODkwMjA=,Ihsan Ullah CEO Arzelona LLC
https://app.seamless-expo.com/event/seamless-saudi-arabia-2024/person/RXZlbnRQZW9wbGVfMzM3NjcxNDA=,Richard Dikran Bezjian CEO Energize Global Services CJSC
https://app.seamless-expo.com/event/seamless-saudi-arabia-2024/person/RXZlbnRQZW9wbGVfMzM3MzY0NjY=,Tarek Rady CEO World Representative
