Link,Info
https://app.seamless-expo.com/event/seamless-saudi-arabia-2024/person/RXZlbnRQZW9wbGVfMzQzNTkyNDg=,AA Abdulrahman Alammar CEO Mawsim
https://app.seamless-expo.com/event/seamless-saudi-arabia-2024/person/RXZlbnRQZW9wbGVfMzQzNTkyNDI=,AOB Abdullah omar Baothman CEO Osolutions
https://app.seamless-expo.com/event/seamless-saudi-arabia-2024/person/RXZlbnRQZW9wbGVfMzQzNTk4NDM=,AM Ali Mumtaz CEO MLSA QAU
https://app.seamless-expo.com/event/seamless-saudi-arabia-2024/person/RXZlbnRQZW9wbGVfMzQzNTk3Mzk=,AR Ameen Rihani CEO alrajhi first holding company
https://app.seamless-expo.com/event/seamless-saudi-arabia-2024/person/RXZlbnRQZW9wbGVfMzQzNTk3Mzc=,AA Abdullah ALquorashi CEO AFAQ SECURITY IT. COMPANY
https://app.seamless-expo.com/event/seamless-saudi-arabia-2024/person/RXZlbnRQZW9wbGVfMzQzNTk3MzM=,MR Mario Rouhana CEO Alhamrani Universal
https://app.seamless-expo.com/event/seamless-saudi-arabia-2024/person/RXZlbnRQZW9wbGVfMzQzNTk0NjI=,TN Tarek Nounou CEO Qsalary
https://app.seamless-expo.com/event/seamless-saudi-arabia-2024/person/RXZlbnRQZW9wbGVfMzQzNTgwNTA=,EG Elyes Grar CEO YELLOMIND CONSULTING
https://app.seamless-expo.com/event/seamless-saudi-arabia-2024/person/RXZlbnRQZW9wbGVfMzQzNTg2NTM=,AA Ashraf Arian CEO Aqary International Group
https://app.seamless-expo.com/event/seamless-saudi-arabia-2024/person/RXZlbnRQZW9wbGVfMzQzNTc1OTY=,SA Senthil Anandan CEO Ether Gulf Enterprise
https://app.seamless-expo.com/event/seamless-saudi-arabia-2024/person/RXZlbnRQZW9wbGVfMzQzNTUxNjk=,DMA Dr. Mustafa AlTaji CEO Gabriel Jobs
https://app.seamless-expo.com/event/seamless-saudi-arabia-2024/person/RXZlbnRQZW9wbGVfMzQzNTM2NTI=,AA Ahmed Ali CEO Wadha Marketing & Advertising
https://app.seamless-expo.com/event/seamless-saudi-arabia-2024/person/RXZlbnRQZW9wbGVfMzQzNTI4Nzc=,MAR MUSA A REHMAN CEO Alwan Co ltd
https://app.seamless-expo.com/event/seamless-saudi-arabia-2024/person/RXZlbnRQZW9wbGVfMzQzNDk3MjQ=,FA Feras Alhamdan CEO LDUN
https://app.seamless-expo.com/event/seamless-saudi-arabia-2024/person/RXZlbnRQZW9wbGVfMzQzNDcwODM=,SB salem binfuraih CEO kutra
https://app.seamless-expo.com/event/seamless-saudi-arabia-2024/person/RXZlbnRQZW9wbGVfMzQzNDU4NTU=,DR Denise Rapitsi CEO Youth Chamber of Commerce and Industry
https://app.seamless-expo.com/event/seamless-saudi-arabia-2024/person/RXZlbnRQZW9wbGVfMzQzNDIyNDM=,AA Ahmed Aljawy CEO UTOPIA
https://app.seamless-expo.com/event/seamless-saudi-arabia-2024/person/RXZlbnRQZW9wbGVfMzQzNDAzMjQ=,MA Mohannad Alonaizan CEO Tourism enterprise
https://app.seamless-expo.com/event/seamless-saudi-arabia-2024/person/RXZlbnRQZW9wbGVfMzQzMzkxNTA=,MAT Mamdoh Al Thunian CEO Arabian For Science & Technology (ASTC)
